{
  "domain": "www.berlin.de",
  "normalizedDomain": "www.berlin.de",
  "robotsTxt": "# TERMS AND CONDITIONS\n#\n# When you use our websites, you agree to be bound by these terms and conditions.\n# If you do not agree to be bound by these terms, you may not use this site.\n# These terms may be changed by changing them on this site. The current version of\n# these terms will apply whenever you use this site.\n#\n# Any automated program to retrieve information from our public websites is only\n# allowed subject to the following restrictions:\n#\n# * It must clearly and uniquely identify itself in the HTTP User-Agent header.\n#   https://webmasters.stackexchange.com/questions/6205/what-user-agent-should-i-set\n#\n# * It must either only access our home page  and/or the RSS feed on that page; or\n#   it must be fully compliant with the Robots Exclusion Protocol.\n#   https://en.wikipedia.org/wiki/Robots_exclusion_standard\n#\n# * At ours discretion any automated program (or particular network suspected of\n#   operating an automated program) may be blocked at any time.\n#\n# Any use or attempted use of an automated program to access pages that are\n# disallowed by ours robots.txt file, or that fails to identify itself as an\n# automated program, is strictly unauthorised and shall be a misuse of our system\n# and this site. If you are unsure whether a given use would be allowed, please\n# contact us at webmaster@berlinonline.net.\n#\n# We may, at any time and without notice, choose to block your access to its\n# websites, without liability to you or any third party. This is entirely at ours\n# discretion in order to protect its intellectual property and to protect its\n# systems from misuse. If you are not operating an automated program and receive a\n# message that your access is blocked, you may contact us at webmaster@berlinonline.net\n# and we may unblock you at its discretion.\n\nUser-agent: AwarioRssBot\nUser-agent: AwarioSmartBot\nDisallow: /\n\nUser-agent: Bytespider\nDisallow: /\n\nUser-Agent: cookiebot\nDisallow: /\n\nUser-Agent: ia_archiver\nDisallow: /\n\nUser-agent: Yisouspider\nDisallow: /\n\nUser-Agent: zoomRank\nDisallow: /\n\nUser-Agent: Mediapartners-Google\nDisallow: /\n\n# as any other google bot it runs out of control (do not respect http status, robots-tag, link-canonical)\n# https://developers.google.com/search/docs/crawling-indexing/google-common-crawlers?hl=de#googleother\nUser-Agent: GoogleOther\nDisallow:\n\n# as any other google bot it runs out of control (do not respect http status, robots-tag, link-canonical)\n# https://developers.google.com/search/docs/crawling-indexing/google-common-crawlers?hl=de#googleother-image\nUser-Agent: GoogleOther-Image\nDisallow:\n\nUser-Agent: Googlebot-News\nDisallow: /\nAllow: /aktuelles/\nAllow: /*/nachrichten/\nAllow: /*/news/\n\nUser-Agent: AdsBot-Google-Mobile\nDisallow: /kino/\nDisallow: /land/\nDisallow: /politik-und-verwaltung/rundschreiben/\nDisallow: /polizei/polizeimeldungen/\nDisallow: /presse/pressemitteilungen/index/search/\nDisallow: /tickets/\n\nUser-Agent: AdsBot-Google\nDisallow: /kino/\nDisallow: /land/\nDisallow: /politik-und-verwaltung/rundschreiben/\nDisallow: /polizei/polizeimeldungen/\nDisallow: /presse/pressemitteilungen/index/search/\nDisallow: /tickets/\n\nUser-Agent: *\nDisallow: /*/(S(*))\nDisallow: /presse/pressemitteilungen/index/search/\n\nSitemap: https://www.berlin.de/sitemap-index.xml\nSitemap: https://www.berlin.de/aktuelles/.sitemap-news-1.xml\nSitemap: https://www.berlin.de/kultur-und-tickets/.sitemap-news-1.xml\nSitemap: https://www.berlin.de/special/.sitemap-news-1.xml\nSitemap: https://www.berlin.de/tickets/.sitemap-news-1.xml\n",
  "globalRules": {
    "paths": {
      "allowed": [],
      "disallowed": [
        "/*/(S(*))",
        "/presse/pressemitteilungen/index/search/"
      ]
    }
  },
  "specificBots": [
    {
      "name": "AwarioRssBot",
      "allowed": false,
      "paths": {
        "allowed": [],
        "disallowed": []
      }
    },
    {
      "name": "AwarioSmartBot",
      "allowed": false,
      "paths": {
        "allowed": [],
        "disallowed": []
      }
    },
    {
      "name": "AwarioRssBot",
      "allowed": false,
      "paths": {
        "allowed": [],
        "disallowed": []
      }
    },
    {
      "name": "AwarioSmartBot",
      "allowed": false,
      "paths": {
        "allowed": [],
        "disallowed": []
      }
    },
    {
      "name": "Bytespider",
      "allowed": false,
      "paths": {
        "allowed": [],
        "disallowed": []
      }
    },
    {
      "name": "cookiebot",
      "allowed": false,
      "paths": {
        "allowed": [],
        "disallowed": []
      }
    },
    {
      "name": "ia_archiver",
      "allowed": false,
      "paths": {
        "allowed": [],
        "disallowed": []
      }
    },
    {
      "name": "Yisouspider",
      "allowed": false,
      "paths": {
        "allowed": [],
        "disallowed": []
      }
    },
    {
      "name": "zoomRank",
      "allowed": false,
      "paths": {
        "allowed": [],
        "disallowed": []
      }
    },
    {
      "name": "Mediapartners-Google",
      "allowed": false,
      "paths": {
        "allowed": [],
        "disallowed": []
      }
    },
    {
      "name": "GoogleOther",
      "allowed": false,
      "paths": {
        "allowed": [],
        "disallowed": []
      }
    },
    {
      "name": "GoogleOther-Image",
      "allowed": false,
      "paths": {
        "allowed": [],
        "disallowed": []
      }
    },
    {
      "name": "Googlebot-News",
      "allowed": false,
      "paths": {
        "allowed": [
          "/aktuelles/",
          "/*/nachrichten/",
          "/*/news/"
        ],
        "disallowed": []
      }
    },
    {
      "name": "AdsBot-Google-Mobile",
      "allowed": true,
      "paths": {
        "allowed": [],
        "disallowed": [
          "/kino/",
          "/land/",
          "/politik-und-verwaltung/rundschreiben/",
          "/polizei/polizeimeldungen/",
          "/presse/pressemitteilungen/index/search/",
          "/tickets/"
        ]
      }
    },
    {
      "name": "AdsBot-Google",
      "allowed": true,
      "paths": {
        "allowed": [],
        "disallowed": [
          "/kino/",
          "/land/",
          "/politik-und-verwaltung/rundschreiben/",
          "/polizei/polizeimeldungen/",
          "/presse/pressemitteilungen/index/search/",
          "/tickets/"
        ]
      }
    }
  ],
  "stats": {
    "totalSpecificBots": 15,
    "allowedBots": 2,
    "disallowedBots": 13,
    "hasGlobalAllow": true
  },
  "bots": [
    {
      "name": "*",
      "allowed": true
    },
    {
      "name": "AwarioRssBot",
      "allowed": false
    },
    {
      "name": "AwarioSmartBot",
      "allowed": false
    },
    {
      "name": "AwarioRssBot",
      "allowed": false
    },
    {
      "name": "AwarioSmartBot",
      "allowed": false
    },
    {
      "name": "Bytespider",
      "allowed": false
    },
    {
      "name": "cookiebot",
      "allowed": false
    },
    {
      "name": "ia_archiver",
      "allowed": false
    },
    {
      "name": "Yisouspider",
      "allowed": false
    },
    {
      "name": "zoomRank",
      "allowed": false
    },
    {
      "name": "Mediapartners-Google",
      "allowed": false
    },
    {
      "name": "GoogleOther",
      "allowed": false
    },
    {
      "name": "GoogleOther-Image",
      "allowed": false
    },
    {
      "name": "Googlebot-News",
      "allowed": false
    },
    {
      "name": "AdsBot-Google-Mobile",
      "allowed": true
    },
    {
      "name": "AdsBot-Google",
      "allowed": true
    }
  ],
  "paths": {
    "allowed": [],
    "disallowed": [
      "/*/(S(*))",
      "/presse/pressemitteilungen/index/search/"
    ]
  }
}